{"atlasId":"workstation-basic-v3-atlas","atlasVersion":1,"entries":[{"entryId":"workstation-basic-mask-0","familyRef":{"id":"workstation-basic","version":3},"frameRef":{"id":"mask-0","version":1},"geometryRef":{"id":"workstation-geometry","version":1},"order":0,"orientation":"south","rect":{"heightPx":96,"widthPx":176,"xPx":0,"yPx":0},"variantId":"isolated"},{"entryId":"workstation-basic-mask-10","familyRef":{"id":"workstation-basic","version":3},"frameRef":{"id":"mask-10","version":1},"geometryRef":{"id":"workstation-geometry","version":1},"order":1,"orientation":"south","rect":{"heightPx":96,"widthPx":176,"xPx":0,"yPx":0},"variantId":"middle"},{"entryId":"workstation-basic-mask-2","familyRef":{"id":"workstation-basic","version":3},"frameRef":{"id":"mask-2","version":1},"geometryRef":{"id":"workstation-geometry","version":1},"order":2,"orientation":"south","rect":{"heightPx":96,"widthPx":176,"xPx":0,"yPx":0},"variantId":"east-end"},{"entryId":"workstation-basic-mask-8","familyRef":{"id":"workstation-basic","version":3},"frameRef":{"id":"mask-8","version":1},"geometryRef":{"id":"workstation-geometry","version":1},"order":3,"orientation":"south","rect":{"heightPx":96,"widthPx":176,"xPx":0,"yPx":0},"variantId":"west-end"}],"extrusionPx":1,"paddingPx":1,"path":"office-v2/atlases/workstation-basic/v3.png","rotation":"forbidden-v1","schemaVersion":"office-atlas-v1","sha256":"1e16214cd773f3f3b3bdd5eaae561eea041a04c952bc15c3a1d6310e3ce17729","trimming":"forbidden-v1"}